{
  "meta": {
    "target_company": "Example Target",
    "industry": "Example sector",
    "geography": "Example geography",
    "research_as_of_date": "2026-06-03"
  },
  "evidence_readiness": {
    "schema_version": "evidence_readiness_v1",
    "decision_status": "llm_decided",
    "decision_owner": "reasoning",
    "decision_note": "Fixture evidence is sufficient for a client-pitch industry section with normal caveats.",
    "enough_for_client_pitch": true,
    "evidence_limited_pitch_outline": false,
    "research_first_required": false,
    "evidence_row_count": 3,
    "metric_row_count": 3,
    "critical_gap_count": 0,
    "research_pack_exists": true
  },
  "issue_analyses": [
    {
      "analysis_id": "IA-001",
      "source_execution_result_ids": ["FR-001"],
      "issue_area": "market_size_growth",
      "subissue": "current_market_size",
      "analysis_type": "descriptive_market_fact",
      "core_statement": "The relevant market is large enough to support a credible pitch discussion when scope and source are explicit.",
      "analysis_text": "The current market-size evidence gives the deck blueprint a defensible starting point: it defines the market scope, ties the number to a reviewed source, and keeps the geographic boundary explicit. The analysis should not be stretched into a broader adjacent-market claim, but it is sufficient to anchor an industry overview and a scoped chart if the source note preserves period, unit, and market definition.",
      "supporting_points": [
        {
          "point": "Market scale is supported by a reviewed market-size source.",
          "evidence_ids": ["EV-001"],
          "metric_ids": ["MET-001"],
          "role": "primary_fact",
          "evidence_sufficiency": "sufficient"
        },
        {
          "point": "Forecast evidence exists but should preserve period assumptions.",
          "evidence_ids": ["EV-002"],
          "metric_ids": ["MET-002"],
          "role": "secondary_fact",
          "evidence_sufficiency": "sufficient"
        }
      ],
      "evidence_sufficiency": "sufficient",
      "evidence_status": "supported",
      "allowed_deck_usage": {
        "headline": true,
        "main_message": true,
        "chart": true,
        "body_copy": true
      },
      "status": "validated",
      "hypothesis_resolution": "resolved",
      "evidence_ids": ["EV-001", "EV-002"],
      "metric_ids": ["MET-001", "MET-002"],
      "limitations": [],
      "downstream_permission": {
        "headline_allowed": true,
        "chart_allowed": true,
        "body_copy_allowed": true
      },
      "candidate_use_cases": ["market_attractiveness"]
    },
    {
      "analysis_id": "IA-002",
      "source_execution_result_ids": ["FR-002"],
      "issue_area": "market_size_growth",
      "subissue": "market_segmentation",
      "analysis_type": "structure_analysis",
      "core_statement": "One structural segmentation axis explains growth better than total market expansion alone.",
      "analysis_text": "The segmentation evidence is useful because it identifies a structural split that the overview page cannot answer by itself. The evidence is thinner than the market-size facts, so it should be used as a drill-down explanation rather than a headline claim that overstates causality. Deck blueprint can use it for a chart if the metric scope stays clear and the page carries a caveat that the split is single-source.",
      "supporting_points": [
        {
          "point": "The structural split is metric-backed, but source coverage remains limited.",
          "evidence_ids": ["EV-001", "EV-002"],
          "metric_ids": ["MET-003"],
          "role": "primary_fact",
          "evidence_sufficiency": "thin"
        }
      ],
      "evidence_sufficiency": "thin",
      "evidence_status": "thin",
      "allowed_deck_usage": {
        "headline": false,
        "main_message": false,
        "chart": true,
        "body_copy": true
      },
      "status": "partially_validated",
      "hypothesis_resolution": "resolved",
      "evidence_ids": ["EV-001", "EV-002"],
      "metric_ids": ["MET-003"],
      "limitations": ["Metric coverage is single-source."],
      "downstream_permission": {
        "headline_allowed": false,
        "chart_allowed": true,
        "body_copy_allowed": true
      },
      "candidate_use_cases": ["market_structure", "growth_drivers"]
    },
    {
      "analysis_id": "IA-003",
      "source_execution_result_ids": ["FR-003"],
      "issue_area": "competitive_dynamics",
      "subissue": "basis_of_competition",
      "analysis_type": "competitive_dynamic",
      "core_statement": "Competitive advantage appears tied to repeatable capabilities rather than a single market share statistic.",
      "analysis_text": "The competitive evidence supports a capability-based lens: companies compete through repeatable operating capabilities, channel access, and product or service differentiation rather than one isolated share number. This analysis can support driver, value-chain, barrier, peer-positioning, and trend pages, provided the renderer does not convert it into target advocacy. The point is an industry framework first and selective target context second.",
      "supporting_points": [
        {
          "point": "Reviewed evidence supports a capability-based competition lens.",
          "evidence_ids": ["EV-001", "EV-003"],
          "metric_ids": [],
          "role": "primary_fact",
          "evidence_sufficiency": "sufficient"
        }
      ],
      "evidence_sufficiency": "sufficient",
      "evidence_status": "supported",
      "allowed_deck_usage": {
        "headline": true,
        "main_message": true,
        "chart": false,
        "body_copy": true
      },
      "status": "validated",
      "hypothesis_resolution": "resolved",
      "evidence_ids": ["EV-001", "EV-003"],
      "metric_ids": [],
      "limitations": [],
      "downstream_permission": {
        "headline_allowed": true,
        "chart_allowed": false,
        "body_copy_allowed": true
      },
      "candidate_use_cases": ["value_chain", "barriers", "competitive_landscape", "strategic_timing", "pitch_relevance"]
    },
    {
      "analysis_id": "IA-004",
      "source_execution_result_ids": ["FR-004"],
      "issue_area": "pitch_relevance_target_context",
      "subissue": "evidence_limits",
      "analysis_type": "evidence_gap",
      "core_statement": "One pitch-relevant target-context claim remains unverified and should stay as a limitation.",
      "analysis_text": "The available public evidence is too thin to turn this target-context claim into a conclusion. It can still help deck blueprint by defining a caveat or discussion boundary, but it must not become a confident headline, chart anchor, or investment highlight. The appropriate use is to remind the renderer that pre-mandate materials should separate sector credibility from target-specific assertions that require management or diligence verification.",
      "supporting_points": [
        {
          "point": "Available public evidence is too thin to promote the claim as a conclusion.",
          "evidence_ids": ["EV-003"],
          "metric_ids": [],
          "role": "caveat",
          "evidence_sufficiency": "thin"
        }
      ],
      "evidence_sufficiency": "thin",
      "evidence_status": "caveat_only",
      "allowed_deck_usage": {
        "headline": false,
        "main_message": false,
        "chart": false,
        "body_copy": false
      },
      "status": "unverified",
      "hypothesis_resolution": "caveat_only",
      "evidence_ids": ["EV-003"],
      "metric_ids": [],
      "limitations": ["Requires management or expert validation."],
      "downstream_permission": {
        "headline_allowed": false,
        "chart_allowed": false,
        "body_copy_allowed": false
      },
      "candidate_use_cases": ["open_question"]
    }
  ],
  "research_backlog": [
    {
      "issue_area": "market_size_growth",
      "subissue": "historical_growth",
      "attempted_statement": "Historical CAGR should be analyzed if comparable time-series evidence exists.",
      "reason": "The fixture keeps this subissue out of deck blueprint.",
      "needed_evidence": ["Comparable historical market-size series"],
      "research_action": "run_targeted_search",
      "downstream_permission": "do_not_use_for_strong_claim"
    },
    {
      "issue_area": "market_size_growth",
      "subissue": "forecast_growth",
      "attempted_statement": "Forecast growth should be analyzed with assumptions.",
      "reason": "The fixture uses IA-001 only for scoped market size.",
      "needed_evidence": ["Forecast growth assumptions"],
      "research_action": "run_targeted_search",
      "downstream_permission": "do_not_use_for_strong_claim"
    },
    {
      "issue_area": "market_size_growth",
      "subissue": "growth_quality",
      "attempted_statement": "Growth quality should separate price, volume, penetration, mix, and channel migration.",
      "reason": "Not needed for this fixture deck blueprint.",
      "needed_evidence": ["Growth decomposition evidence"],
      "research_action": "run_targeted_search",
      "downstream_permission": "use_only_as_context"
    },
    {
      "issue_area": "market_size_growth",
      "subissue": "market_cycle",
      "attempted_statement": "Market cycle should be analyzed where relevant.",
      "reason": "Not needed for this fixture deck blueprint.",
      "needed_evidence": ["Cycle or replacement-period evidence"],
      "research_action": "run_targeted_search",
      "downstream_permission": "use_only_as_context"
    },
    {
      "issue_area": "demand_customer_logic",
      "subissue": "customer_segments",
      "attempted_statement": "Customer segments should be identified.",
      "reason": "Demand logic is not used by this minimal fixture.",
      "needed_evidence": ["Customer segmentation source"],
      "research_action": "run_targeted_search",